[
 {
  "id": "Q-001",
  "generated_at_phase": "investigation",
  "category": "architecture_decision",
  "body": "テンプレート選定判定ロジックは README に基準のみが記載されているが、その判定を自動化するコードパスは存在するのか？Phase 1 で Claude が手動で判定しているのか、それとも機械的な判定ロジックがあるのか？",
  "severity": "important",
  "resolution_type": "ask_sme",
  "status": "answered",
  "answer": "Phase 1 では template-catalog.md の decision tree を Claude が参照して手動判定する。自動化コードパスは存在しない。",
  "answerer": "agent_inference",
  "answered_at": "2026-07-30T08:53:01.826283Z",
  "related_question_ids": []
 },
 {
  "id": "Q-002",
  "generated_at_phase": "investigation",
  "category": "architecture_decision",
  "body": "Question Bank の自動マージアルゴリズムで「obviously identical」と判断する具体基準は何か？類似質問のグルーピングはどの程度の類似度で自動実行されるのか？",
  "severity": "important",
  "resolution_type": "ask_sme",
  "status": "answered",
  "answer": "推測による回答を spec に反映（Phase 5 対話にて確認済み）",
  "answerer": "agent_inference",
  "answered_at": "2026-07-30T08:55:04.439976+00:00",
  "related_question_ids": []
 },
 {
  "id": "Q-003",
  "generated_at_phase": "investigation",
  "category": "operational_requirement",
  "body": "Depth モード自動選択の「200ファイル」判定基準に、テストファイルや設定ファイルは含まれるのか？また、.git や node_modules を除外した後のカウントなのか？",
  "severity": "important",
  "resolution_type": "ask_sme",
  "status": "answered",
  "answer": "200ファイル閾値は source-map.py がスキャンした実ファイル数（.git/node_modules 除外後）に基づく。テストファイルや設定ファイルも含まれる。",
  "answerer": "agent_inference",
  "answered_at": "2026-07-30T08:53:55.704347+00:00",
  "related_question_ids": []
 },
 {
  "id": "Q-004",
  "generated_at_phase": "investigation",
  "category": "architecture_decision",
  "body": "Phase 7 (Drift Detection) でドリフトが検出された後、自動的に Phase 5 (Dialogue) に戻って対話精緻化を行うのか？それとも別のフローが定義されているのか？phase-7-drift.md の内容が未確認。",
  "severity": "nice-to-have",
  "resolution_type": "ask_sme",
  "status": "skipped",
  "answer": "nice-to-have。重要度選択により Phase 5 でスキップ。",
  "answerer": "user",
  "answered_at": "2026-07-30T08:55:04.439976+00:00",
  "related_question_ids": []
 },
 {
  "id": "Q-005",
  "generated_at_phase": "investigation",
  "category": "operational_requirement",
  "body": "Question の abandoned 判定に関する SLA や定量的な閾値はあるか？「永遠に答えが出ない」以外に、一定期間未回答の場合に自動 abandoned にする仕組みはあるか？",
  "severity": "nice-to-have",
  "resolution_type": "ask_sme",
  "status": "skipped",
  "answer": "nice-to-have。重要度選択により Phase 5 でスキップ。",
  "answerer": "user",
  "answered_at": "2026-07-30T08:55:04.439976+00:00",
  "related_question_ids": []
 },
 {
  "id": "Q-006",
  "generated_at_phase": "investigation",
  "category": "architecture_decision",
  "body": "source_map_v2 が tree-sitter 未インストール時にファイルレベルユニットにフォールバックする際、1ファイルから複数ユニットを抽出するルールはあるのか？それとも1ファイル＝1ユニットになるのか？",
  "severity": "important",
  "resolution_type": "ask_sme",
  "status": "answered",
  "answer": "tree-sitter 未インストール時のファイルレベルフォールバックでは、source-map.py(v1) のロジックにより1ファイルから複数ユニット（クラス・関数）を抽出可能。source_map_v2 の v2 パイプラインでも、tree-sitter が無い言語は言語非依存の基本抽出器にフォールバックする。",
  "answerer": "agent_inference",
  "answered_at": "2026-07-30T08:53:55.704601+00:00",
  "related_question_ids": []
 },
 {
  "id": "Q-007",
  "generated_at_phase": "investigation",
  "category": "architecture_decision",
  "body": "SKILL.md や phase-*.md 等のスキル本体ファイルは、今後日本語版が整備される予定はあるか？現状は英語ベースで、実行時に output_language に応じて動的翻訳しているが、バイリンガル版のメンテナンス方針が不明。",
  "severity": "nice-to-have",
  "resolution_type": "ask_sme",
  "status": "skipped",
  "answer": "nice-to-have。重要度選択により Phase 5 でスキップ。",
  "answerer": "user",
  "answered_at": "2026-07-30T08:55:04.439976+00:00",
  "related_question_ids": []
 },
 {
  "id": "Q-008",
  "generated_at_phase": "verification",
  "category": "architecture_decision",
  "body": "coverage-check.py の MECE チェックで「全ソースユニットの70%以上を spec がカバー」と要求しているが、Library/SDK テンプレートでは内部構造の全関数を個別に記述するのは実用的でない。この閾値はテンプレート種別によって調整されるべきか？",
  "severity": "important",
  "resolution_type": "ask_sme",
  "status": "answered",
  "answer": "推測による回答を spec に反映（Phase 5 対話にて確認済み）",
  "answerer": "agent_inference",
  "answered_at": "2026-07-30T08:55:04.439976+00:00",
  "related_question_ids": []
 },
 {
  "id": "Q-009",
  "generated_at_phase": "verification",
  "category": "operational_requirement",
  "body": "specback が自身をターゲットに実行するセルフドキュメンテーションの場合、通常の「コード→仕様」フローと異なり、specback 自身のコードが解析対象かつ仕様生成エンジンになる。この自己参照的な実行における制約や注意点はあるか？",
  "severity": "important",
  "resolution_type": "ask_sme",
  "status": "answered",
  "answer": "セルフドキュメンテーションに特別な制約はなく、通常フローと同様に実行可能。source-map.py は自身のコードも解析対象とする。",
  "answerer": "agent_inference",
  "answered_at": "2026-07-30T08:55:04.439976+00:00",
  "related_question_ids": []
 },
 {
  "id": "Q-010",
  "generated_at_phase": "verification",
  "category": "business_rule",
  "body": "「design principle #10: Dual-consumer handling reduced to one in goal」の実運用において、同じコードベースに対して保守開発者向けと顧客向けの2種類の仕様書が必要な場合、ユーザーは2回 specback を実行する想定か？それとも1回の実行で両方出力する意図か？",
  "severity": "nice-to-have",
  "resolution_type": "ask_sme",
  "status": "answered",
  "answer": "Dual-consumer は非推奨。詳細は specs/09-known-constraints.md §9.4.5 を参照。",
  "answerer": "user",
  "answered_at": "2026-07-30T08:55:04.439976+00:00",
  "related_question_ids": []
 },
 {
  "id": "Q-011",
  "generated_at_phase": "investigation",
  "category": "architecture_decision",
  "body": "第2章の機能カタログで Depth モード（F-006）とディープダイブ（F-011）は、対話選択と自動選択の両方を含み境界が曖昧。両機能の選択ロジックの明確化が必要か？",
  "severity": "important",
  "resolution_type": "ask_sme",
  "status": "open",
  "related_question_ids": []
 },
 {
  "id": "Q-012",
  "generated_at_phase": "investigation",
  "category": "operational_requirement",
  "body": "マルチスコープ対応（F-008）の状態ディレクトリ分離（.specback-{scope-name}/）の定義は phase ドキュメントのどこに存在するのか？参照箇所の明記が必要。",
  "severity": "nice-to-have",
  "resolution_type": "ask_sme",
  "status": "open",
  "related_question_ids": []
 },
 {
  "id": "Q-013",
  "generated_at_phase": "investigation",
  "category": "architecture_decision",
  "body": "機能カタログの Auth required 列は specback に認証概念が無いため全て no としたが、テンプレートの意図する「機能への認証要件」の記述方針はこれで良いか？",
  "severity": "important",
  "resolution_type": "ask_sme",
  "status": "open",
  "related_question_ids": []
 },
 {
  "id": "Q-014",
  "generated_at_phase": "investigation",
  "category": "architecture_decision",
  "body": "source_map_v2 の extractors/ には15言語の抽出器が存在するが、第1章（specs/01-overview.md）は「対応言語は9言語」と記載している。どちらが正しく、第1章の記述はいつ時点の情報か？",
  "severity": "important",
  "resolution_type": "ask_sme",
  "status": "open",
  "related_question_ids": []
 },
 {
  "id": "Q-015",
  "generated_at_phase": "investigation",
  "category": "operational_requirement",
  "body": "スクリプトの docstring は Python 3.10+ を要求するが、CI の検証は 3.11/3.12 のみ、リポジトリ内に .mypy_cache/3.9 の残骸も存在する。サポート下限バージョンは公式には 3.9 か 3.10 か？",
  "severity": "important",
  "resolution_type": "ask_sme",
  "status": "open",
  "related_question_ids": []
 },
 {
  "id": "Q-016",
  "generated_at_phase": "investigation",
  "category": "architecture_decision",
  "body": "templates/infrastructure.md が実在するが、references/template-catalog.md の「Initial set of 4」にも phase-1-recon.md の選択肢一覧にも含まれない。カタログ外テンプレートは意図的なのか、追加予定なのか？",
  "severity": "nice-to-have",
  "resolution_type": "ask_sme",
  "status": "open",
  "related_question_ids": []
 },
 {
  "id": "Q-017",
  "generated_at_phase": "investigation",
  "category": "architecture_decision",
  "body": "source-map.py（v1, 正規表現ベース）と source_map_v2/（v2, tree-sitter ベース）が並存する理由と、v1 の廃止予定はあるのか？第1章は v2 を主としつつ v1 を残す設計判断の根拠が不明。",
  "severity": "important",
  "resolution_type": "ask_sme",
  "status": "open",
  "related_question_ids": []
 },
 {
  "id": "Q-018",
  "generated_at_phase": "investigation",
  "category": "operational_requirement",
  "body": "schemas/ の JSON Schema 3種は validate-schema.py から検証可能だが、どの phase 文書も validate-schema.py や schemas/ を明示的に参照していない。検証はいつ・誰が実行する想定か？",
  "severity": "nice-to-have",
  "resolution_type": "ask_sme",
  "status": "open",
  "related_question_ids": []
 },
 {
  "id": "Q-019",
  "generated_at_phase": "investigation",
  "category": "operational_requirement",
  "body": "CHANGELOG には v1.0.0 セクションが存在せず、[Unreleased] 節に v1.0.0 リリース時点の変更と v1.0.0 以降の変更が混在している。CHANGELOG 側に v1.0.0 セクションを新設する予定はあるか？",
  "severity": "important",
  "resolution_type": "ask_sme",
  "status": "open",
  "related_question_ids": []
 },
 {
  "id": "Q-020",
  "generated_at_phase": "investigation",
  "category": "operational_requirement",
  "body": "状態ディレクトリの rename や goal.json のスキーマ更新を自動化するマイグレーションスクリプトは提供されていない（手動移行のみ）。提供予定はあるか？",
  "severity": "nice-to-have",
  "resolution_type": "ask_sme",
  "status": "open",
  "related_question_ids": []
 },
 {
  "id": "Q-021",
  "generated_at_phase": "investigation",
  "category": "business_rule",
  "body": "「What counts as a file」の明文化（#84）が phase-1-recon.md から削除され、現在は specs/13-known-constraints.md にのみ残っている。ドキュメントの二重管理による記述散逸リスクへの対応方針は？",
  "severity": "nice-to-have",
  "resolution_type": "ask_sme",
  "status": "open",
  "related_question_ids": []
 },
 {
  "id": "Q-022",
  "generated_at_phase": "investigation",
  "category": "operational_requirement",
  "body": ".specback/skill/ ステージングでバンドル複製していた v0.6.x 利用者が、.skill-path 方式（#62）に気づかず旧コピーを使い続けると、バンドル更新が反映されない。周知の継続方針は？",
  "severity": "nice-to-have",
  "resolution_type": "ask_sme",
  "status": "open",
  "related_question_ids": []
 }
]